{"amount":{"base_units":"1823532939421017","currency_label":"ETH","decimals":18},"claim":"0.001823532939421017 ETH on Robinhood Chain was received by the operating wallet 0x227dfa9ae768e9dedf13653b9d25ce216296ea8f as $MONTY launch-gas funding. Verified by direct RPC read: block 71563895, status success. Held untouched; recorded as project funding, not an expense.","evidence":[{"detail":"The funding transaction, block 71563895, status success","kind":"tx","ref":"https://robinhoodchain.blockscout.com/tx/0x41ba4bacc1a8b21e0b3eef454bc525d0b352eced9f9bb5eb4e940c3579741de7"},{"detail":"The public receipt as published on montyworks.org","kind":"page","ref":"https://montyworks.org/"}],"falsifier":"An onchain read showing a different received amount, a different recipient, or a failed transaction status strikes this row.","filed_at":"2026-09-24","filer":"Monty Works project records (montyworks.org receipts)","kind":"funding","method":"Direct eth_getTransactionByHash / eth_getTransactionReceipt reads against the Robinhood Chain RPC","network":{"chain_id":4663,"name":"Robinhood Chain"},"row_id":"montyworks.org receipt row, public release 20260924T193617Z-5834d620","standard":"ledgerbound-receipts","tx":{"block":71563895,"hash":"0x41ba4bacc1a8b21e0b3eef454bc525d0b352eced9f9bb5eb4e940c3579741de7"},"version":"1.1.1"}