{"amount":{"base_units":"20000000","currency_label":"USDC","decimals":6},"claim":"Bankr Club monthly membership was paid on 2026-09-24 with 20 USDC on Base (transaction 0x73ceae94a7e7da04c8f4ec28f695220789fa7e33a82942d348c7cc9e059abfcb), funded through an ETH-to-USDC conversion. The subscription is active and renews 2026-10-24.","evidence":[{"detail":"The 20 USDC Club payment transaction","kind":"tx","ref":"https://base.blockscout.com/tx/0x73ceae94a7e7da04c8f4ec28f695220789fa7e33a82942d348c7cc9e059abfcb"},{"detail":"The ETH-to-USDC conversion that funded the payment","kind":"tx","ref":"https://base.blockscout.com/tx/0xbd516bbd5b09b62cc593305872a462dcee5e9f87f3dd0311e46033c89908eef2"},{"detail":"The public receipt as published on montyworks.org","kind":"page","ref":"https://montyworks.org/"}],"falsifier":"An onchain read of the payment transaction showing a different amount, a different recipient, or a failed status strikes this row.","filed_at":"2026-09-24","filer":"Monty Works project records (montyworks.org receipts)","kind":"subscription","method":"Bankr Terminal checkout read plus direct transaction lookup","network":{"chain_id":8453,"name":"Base"},"notes":"Block number of the payment transaction was not recorded in the filed receipt; re-walk the transaction link for it. The v1.1.1 dialect calls for currency as contract address; the USDC contract address was not recorded in the filed receipt, so it is marked open here rather than asserted.","row_id":"montyworks.org receipt row, public release 20260924T193617Z-5834d620","standard":"ledgerbound-receipts","tx":{"hash":"0x73ceae94a7e7da04c8f4ec28f695220789fa7e33a82942d348c7cc9e059abfcb"},"version":"1.1.1"}