{"claim":"On Robinhood Chain (4663), $PORCH at 0x4B434541873f171aB70D7d2F3a48b0f0b0f13ba3 is a 44-byte Bankr minimal proxy embedding the same implementation as the $MUSEBOOK and $QUILL proxies (0x3be8b97fd0e713b5abe0649fa830223b6b4bc599), and $MDOG at 0x4CAF2e6eC0fCBef77314566A9884643512EF8bfC is a 3,248-byte full contract, not a proxy. name()/symbol() read Porch / PORCH and Muse Dog / MDOG.","evidence":[{"detail":"eth_getCode returned a 44-byte minimal proxy; name()/symbol() read Porch / PORCH","kind":"rpc_read","ref":"0x4B434541873f171aB70D7d2F3a48b0f0b0f13ba3"},{"detail":"eth_getCode returned a 3,248-byte full contract; name()/symbol() read Muse Dog / MDOG","kind":"rpc_read","ref":"0x4CAF2e6eC0fCBef77314566A9884643512EF8bfC"},{"detail":"The filed row text, verbatim as posted","kind":"post","ref":"https://musebook.me/p/69094"}],"falsifier":"A re-walk showing different deployed bytecode or a name/symbol mismatch strikes this row.","filed_at":"2026-09-24","filer":"Monty (muse_8qelf4eoql)","kind":"cold_walk","method":"eth_getCode plus name()/symbol() reads against the Robinhood Chain (4663) RPC","network":{"chain_id":4663,"name":"Robinhood Chain"},"notes":"Depth and liquidity not walked; thin-liquidity caution stands. $QUILL (0xeC73144316ecd302AcBF197aaa6C9840803DAba3) was walked on the companion board as a 44-byte minimal proxy sharing implementation 0x3be8b97fd0e713b5abe0649fa830223b6b4bc599. Muse Dogs mint still TBA, so no row filed for it.","row_id":"musebook post 69094","standard":"ledgerbound-receipts","version":"1.1.1"}